,link,tipo,fecha_view,nombre_id,precio,direccion,puntuacion,descripcion,calficacion_tx,sitio_web,ciudad
29,https://www.tripadvisor.com///Hotel_Review-g303845-d1153766-Reviews-Hotel_Malecon_Inn-Guayaquil_Guayas_Province.html,hotel,2022-10-31,Hotel Malecon Inn,31.5,"Calle Sucre # 203 y Pichincha, Guayaquil 090150 Ecuador",2.5,"Welcome to Hotel Malecon Inn, your Guayaquil “home away from home.” Hotel Malecon Inn aims to make your visit as relaxing and enjoyable as possible, which is why so many guests continue to come back year after year.Given the close proximity of popular landmarks, such as Mirador Bellavista (1.5 mi) and George Capwell Stadium (1.9 mi), guests of Hotel Malecon Inn can easily experience some of Guayaquil's most well known attractions.Guest rooms offer air conditioning, and Hotel Malecon Inn makes getting online easy as free wifi is available.You can also take advantage of some of the amenities offered by the motel, including a 24 hour front desk and baggage storage. In addition, guests can enjoy a fitness center during their visit.During your visit, be sure to check out one of Guayaquil's popular shrimp restaurants such as La Canoa, Caracol Azul, and Lo Nuestro Cafe - Restaurant, all a short distance from Hotel Malecon Inn.During your visit, be sure to check out Parque Historico Guayaquil (0.2 mi), which is a popular attraction within walking distance of the motel.Hotel Malecon Inn puts the best of Guayaquil at your fingertips, making your stay both relaxing and enjoyable.",Average,https://www.tripadvisor.com///Hotel_Review-g303845-d1153766-Reviews-Hotel_Malecon_Inn-Guayaquil_Guayas_Province.html,guayaquil
30,https://www.tripadvisor.com///Hotel_Review-g303845-d2453749-Reviews-Hotel_Berlin-Guayaquil_Guayas_Province.html,hotel,2022-10-31,Hotel Berlin,18.0,"Rumichaca 1503, Guayaquil 090150 Ecuador",2.0,"Conveniently located in the Centro de Guayaquil district of Guayaquil, Hotel Berlín is set less than 1 km from Saint Francis Church, a 14-minute walk from Malecon 2000 and 500 metres from Las Iguanas Park. The property is situated 1.",Poor,https://www.tripadvisor.com///Hotel_Review-g303845-d2453749-Reviews-Hotel_Berlin-Guayaquil_Guayas_Province.html,guayaquil
31,https://www.tripadvisor.com///Hotel_Review-g303845-d4213909-Reviews-Hotel_Onix_Gold-Guayaquil_Guayas_Province.html,hotel,2022-10-31,Hotel Onix Gold,25.5,"José de Antepara 514 entre Padre Solano y Luis Urdaneta, Guayaquil 090150 Ecuador",2.5,"Finding an ideal budget friendly small hotel in Guayaquil does not have to be difficult. Welcome to Hotel Onix Gold, a nice option for travelers like you.Close to some of Guayaquil's most popular landmarks, such as Iglesia San Francisco (0.7 mi) and Captain Morgan's Pirate Ship (0.9 mi), Hotel Onix Gold is a great destination for tourists.Hotel Onix Gold offers guests an array of room amenities including air conditioning, and getting online is possible, as free wifi is available.The small hotel offers a 24 hour front desk, room service, and a concierge, to make your visit even more pleasant. The property also features a lounge. Guests arriving by vehicle have access to street parking.During your visit, be sure to check out a popular Guayaquil lobster restaurant such as Lo Nuestro Cafe - Restaurant, which is a short distance from Hotel Onix Gold.There is no shortage of things to do in the area: explore popular parks such as Parque de la Kennedy, Parque Seminario, and Parque Samanes.Hotel Onix Gold looks forward to welcoming you on your visit to Guayaquil.",Average,https://www.tripadvisor.com///Hotel_Review-g303845-d4213909-Reviews-Hotel_Onix_Gold-Guayaquil_Guayas_Province.html,guayaquil
32,https://www.tripadvisor.com///Hotel_Review-g303845-d10255975-Reviews-Hacienda_La_Danesa-Guayaquil_Guayas_Province.html,hotel,2022-10-31,Hacienda La Danesa,476.5,"Km 67 Autopista Naranjito Bucay, Guayaquil 090150 Ecuador",5.0,"Hacienda La Danesa is a traditional dairy and cacao farm with over 145 years of rich heritage and history, located about an hour drive from Guayaquil, Ecuador. Family-owned and managed by the third generation Olsen family, the farm o ers a unique selection of tailor-made activities for guests, including horseback riding trails, hands-on artisan chocolate making and other hacienda-related programs.",Excellent,https://www.tripadvisor.com///Hotel_Review-g303845-d10255975-Reviews-Hacienda_La_Danesa-Guayaquil_Guayas_Province.html,guayaquil
0,https://www.tripadvisor.com///Hotel_Review-g312858-d2263865-Reviews-La_Estelita-Ibarra_Imbabura_Province.html,hotel,2022-10-31,La Estelita,119.5,"Km. 5 Via Yuracrucito, a 3 Km. del Arcangel, Ibarra 100150 Ecuador",4.5,"See why so many travelers make La Estelita their resort of choice when visiting Ibarra. Providing an ideal mix of value, comfort and convenience, it offers a family-friendly setting with an array of amenities designed for travelers like you.La Estelita features a concierge, to help make your stay more enjoyable. The property also boasts a pool and free breakfast. If you are driving to La Estelita, free parking is available.During your visit, be sure to check out one of Ibarra's popular delis such as La Hacienda Cafe Delicatessen, La Botica Café, and Annapurna, all a short distance from La Estelita.At La Estelita, your comfort and satisfaction come first, and they look forward to welcoming you to Ibarra.",Excellent,https://www.tripadvisor.com///Hotel_Review-g312858-d2263865-Reviews-La_Estelita-Ibarra_Imbabura_Province.html,ibarra
1,https://www.tripadvisor.com///Hotel_Review-g312858-d673995-Reviews-Hacienda_Hosteria_Chorlavi-Ibarra_Imbabura_Province.html,hotel,2022-10-31,Hacienda- Hosteria Chorlavi,118.0,"Panamericana km 4. 5, Ibarra 100150 Ecuador",4.5,"ACCOMODATIONS: 50 Rooms with modern bathrooms, 13 of our rooms have chimneys, 23 of our rooms have DirecTV• RESTAURANT SERVICE: National & International Cuisine with ample wine selection • ENTRETAINMENTE every Saturday during lunch hours we have live music and folkloric dances, Indian choreographies with authentic and colorful costumes.• Movie and Karaoke lounge Pool table, darts and fusball, family roomReading areas with peaceful and beautiful scenes• INTERNET SERVICE: Wi-Fi available in all rooms and all areas of the Hacienda• BUSINESS CENTER • SPA",Excellent,https://www.tripadvisor.com///Hotel_Review-g312858-d673995-Reviews-Hacienda_Hosteria_Chorlavi-Ibarra_Imbabura_Province.html,ibarra
2,https://www.tripadvisor.com///Hotel_Review-g312858-d2564683-Reviews-Hostel_Fevilamir-Ibarra_Imbabura_Province.html,hotel,2022-10-31,Hostel Fevilamir,27.5,"Street Juan Francisco Cevallos 1-53 y Obispo Mosquera, Ibarra 100150 Ecuador",4.0,"Fevilamir HOSTEL welcomes you! An ideal place for a relaxing restful for domestic tourists and international in the White City of Ibarra , the province Imbabura , surrounded by lakes and breathtaking and stunning landscapes in the heart of the Andes , Republic of Ecuador . We invite you to stay in our hostel Fevilamir , hoping to enjoy a stay pleasant and enjoyable in our province. Our website allows you to discover our comfortable rooms and know us as hosts .",Very good,https://www.tripadvisor.com///Hotel_Review-g312858-d2564683-Reviews-Hostel_Fevilamir-Ibarra_Imbabura_Province.html,ibarra
3,https://www.tripadvisor.com///Hotel_Review-g312858-d2487185-Reviews-Hosteria_Cananvalle-Ibarra_Imbabura_Province.html,hotel,2022-10-31,Hosteria Cananvalle,75.5,"Linea Ferrea Km 167, Ibarra 100150 Ecuador",5.0,"This agro-tourism ten-acre working farm and family–owned hotel, operated with social responsibility principles, overlooks a river canyon with views of two (and sometimes three) volcanoes. It is located ten minutes from the city of Ibarra, Imbabura. At an elevation of 2.192 m (7,200 ft), we have spring weather all year long, with temperatures ranging between 10-27oC (50- 80oF). Open as of December 2011.",Excellent,https://www.tripadvisor.com///Hotel_Review-g312858-d2487185-Reviews-Hosteria_Cananvalle-Ibarra_Imbabura_Province.html,ibarra
4,https://www.tripadvisor.com///Hotel_Review-g312858-d1977810-Reviews-Hotel_La_Giralda-Ibarra_Imbabura_Province.html,hotel,2022-10-31,Hotel La Giralda,70.5,"Av. Atahualpa 15-142 Juan Francisco Bonilla, Ibarra 100105 Ecuador",3.5,"Looking for a place to stay in Ibarra? Then look no further than Hotel La Giralda, a hotel that brings the best of Ibarra to your doorstep.Guest rooms offer amenities such as a refrigerator and a desk, and guests can go online with free wifi offered by the hotel.Hotel La Giralda features a 24 hour front desk, room service, and a concierge, to help make your stay more enjoyable. The property also boasts a pool and free breakfast. If you are driving to Hotel La Giralda, free parking is available.While in Ibarra be sure to experience nearby Mediterranean restaurants such as La Pergola Ibarra, Pour Toi Gourmet, or La Bella Italia.We’re sure you’ll enjoy your stay at Hotel La Giralda as you experience everything Ibarra has to offer.",Very good,https://www.tripadvisor.com///Hotel_Review-g312858-d1977810-Reviews-Hotel_La_Giralda-Ibarra_Imbabura_Province.html,ibarra
5,https://www.tripadvisor.com///Hotel_Review-g312858-d308807-Reviews-Hotel_Ajavi-Ibarra_Imbabura_Province.html,hotel,2022-10-31,Hotel Ajavi,122.0,"Ave. Mariano Acosta 1638 And Cristobal Gomez Jurado, Ibarra 100150 Ecuador",4.0,"Hotel Ajavi is an excellent choice for travelers visiting Ibarra, offering a family-friendly environment alongside many helpful amenities designed to enhance your stay.Hotel Ajavi features room service and a concierge, to help make your stay more enjoyable. The property also boasts a pool and free breakfast. If you are driving to Hotel Ajavi, free parking is available.If you’re looking for a barbeque restaurant, consider a visit to Chamuyando, Ibérica Ribs, or La Parrilla del Tio Jessy, which are all conveniently located a short distance from Hotel Ajavi.Enjoy your stay in Ibarra!",Very good,https://www.tripadvisor.com///Hotel_Review-g312858-d308807-Reviews-Hotel_Ajavi-Ibarra_Imbabura_Province.html,ibarra
6,https://www.tripadvisor.com///Hotel_Review-g312858-d2573314-Reviews-San_Andres_Lodge_Spa-Ibarra_Imbabura_Province.html,hotel,2022-10-31,San Andres Lodge & Spa,85.0,"Avenida 13 De Abril 17-54 Y Esmeraldas, Ibarra 100150 Ecuador",4.0,"San Andres Lodge & Spa is located in the northern province of Imbabura, also known as the ""Province of the Lakes"". The city center of Ibarra, is only 7 minutes away from our lodge, and the best known tourist attractions are only a few minutes away. Take your time to enjoy Imbabura and all it has to offer from the ""Plaza de Ponchos""in Otavalo, to the leather crafts in Cotacachi or the wood carvings in San Antonio. Our restaurante is opened daily from 8am to 9pm offering a wide variety of suculent options. Sauna, steam bath, and covered pool are exclusive to our guests. Looking for relax? ... we offer massages with different techniques that will sure take your tensions away. 24 beautifully appointed rooms from single occupancy to family accommodation will surely satisfy your needs.",Very good,https://www.tripadvisor.com///Hotel_Review-g312858-d2573314-Reviews-San_Andres_Lodge_Spa-Ibarra_Imbabura_Province.html,ibarra
7,https://www.tripadvisor.com///Hotel_Review-g312858-d308802-Reviews-Hosteria_Natabuela-Ibarra_Imbabura_Province.html,hotel,2022-10-31,Hosteria Natabuela,64.0,"Hwy 35 (Panamericana Sur Km 8, Ibarra 100150 Ecuador",4.0,"Set in Natabuela, 10 km from Central Bank Museum, Hotel y Hosteria Natabuela offers accommodation with a restaurant, free private parking, a shared lounge and a garden. All rooms feature a TV with cable channels and a private bathroom.",Very good,https://www.tripadvisor.com///Hotel_Review-g312858-d308802-Reviews-Hosteria_Natabuela-Ibarra_Imbabura_Province.html,ibarra
8,https://www.tripadvisor.com///Hotel_Review-g312858-d3563998-Reviews-Hostal_Refugio_Terra_Esperanza-Ibarra_Imbabura_Province.html,hotel,2022-10-31,Hostal Refugio Terra Esperanza,26.5,"Calle Galo Plaza Lasso La Esperanza, Ibarra 100101 Ecuador",5.0,"Our refugio is a very special place in the middle of the mountains, surrounded by lots of green. We are located just 15 minutes from the Historical Center of Ibarra, a 0.30 USDbus or a 4 USD taxi ride away. From our refugio you can go on ecological trecks by yourself close to the hostel or join hikes organized by us. We are the starting point for many different hiking routes in the region and we can offer you a multitude of options. However, our main destinations are Imbabura just behind the house and the symbol of our region Imbabura (8-10 hours), Lago Cubilche (4-5 hours), La Routa de los Karanquis (8-10 hours), The Three-Waterfall-Trek (4-5 hours), The Hidden Thermal Baths (8-10 hours) and many more! With us you also have the opportunity to learn how to make traditional leather crafts, we would love to help you to make your own souvenir! In the evening you can have a cozy time by the fire and learn how to dance ""San Juan"", a typical dance with sombreros and ponchos.",Excellent,https://www.tripadvisor.com///Hotel_Review-g312858-d3563998-Reviews-Hostal_Refugio_Terra_Esperanza-Ibarra_Imbabura_Province.html,ibarra
9,https://www.tripadvisor.com///Hotel_Review-g312858-d599517-Reviews-Hacienda_Primavera_Wilderness_Ecolodge-Ibarra_Imbabura_Province.html,hotel,2022-10-31,Hacienda Primavera Wilderness Ecolodge,127.5,"Caserio Primavera, Ibarra 59362 Ecuador",5.0,The hacienda is located three hours Northwest of Quito and one and a half hours Northwest of Otavalo and Ibarra The same family has owned the hacienda for over 90 years. Renovated luxury suites.,Excellent,https://www.tripadvisor.com///Hotel_Review-g312858-d599517-Reviews-Hacienda_Primavera_Wilderness_Ecolodge-Ibarra_Imbabura_Province.html,ibarra
10,https://www.tripadvisor.com///Hotel_Review-g312858-d604386-Reviews-Hotel_Montecarlo-Ibarra_Imbabura_Province.html,hotel,2022-10-31,Hotel Montecarlo,61.5,"Av. Jaime Rivadeneira 555 Oviedo, Ibarra 100150 Ecuador",4.0,"We care about you. Being a small Hotel allow us to attend you in a more friendly and familiar way. So can you can ask for some insider tips or just tell us how your day was. With 33 rooms and 2 suites, Hotel Montecarlo is located at the heart of Ibarra. Every room has a private bathroom with hot water, cable TV and a telephone. We have Internet WiFi it's free for our customers. You can relax in our Jacuzzi, Turkish bath or sauna, as well as enjoy our small gym and swimming pool (only weekends and national holidays). You can also enjoy a very delicious cuisine in our restaurant. We also provide a conference room for events and meetings. We care also about the environment and therefore we heat the water for the rooms mostly with solar energy among other measurements.",Very good,https://www.tripadvisor.com///Hotel_Review-g312858-d604386-Reviews-Hotel_Montecarlo-Ibarra_Imbabura_Province.html,ibarra
11,https://www.tripadvisor.com///Hotel_Review-g312858-d8929722-Reviews-Hosteria_Totoral-Ibarra_Imbabura_Province.html,hotel,2022-10-31,Hosteria Totoral,102.5,"Autopista Internacional de Yahuarcocha KM 5, Ibarra 100150 Ecuador",3.0,"We are committed focused in offering a world class service and exclusive entertainment activities. Hosteria Totoral is the home of travelers looking for adventure in a peaceful environment. We are well prepared to host executives coming to do business in Ibarra and who wish to quiet and calm time after a long working day. Featuring its 14 Acre land full of beautiful gardens, Hosteria Totoral gives its guests the privilege of enjoying its Marina and water sports, such as kayaking and fishing. Our facilities include, tennis courts, paddle courts and a soccer field, all of them can be enjoyed by our customers completely free of charge. Our guests can enjoy a horseback ride within the property limits, as well as free bicycle rides. For those more adventurous, there are plenty of trails in the surrounding area, as well as the 10 kilometer bike path around the lake.",Average,https://www.tripadvisor.com///Hotel_Review-g312858-d8929722-Reviews-Hosteria_Totoral-Ibarra_Imbabura_Province.html,ibarra
12,https://www.tripadvisor.com///Hotel_Review-g312858-d8707338-Reviews-Backpacker_Hostal-Ibarra_Imbabura_Province.html,hotel,2022-10-31,Backpacker Hostal,19.0,"Flores 3-59 Entre Salinas y Maldonado Junto a la Discoteca Zoom, Ibarra 100150 Ecuador",4.0,Our hostel is located in the center of the city of Ibarra and offers the hosting service in a quiet and comfortable environment with pleasant environments where there is the opportunity to meet guests from different nationalities and different cultures share.,Very good,https://www.tripadvisor.com///Hotel_Review-g312858-d8707338-Reviews-Backpacker_Hostal-Ibarra_Imbabura_Province.html,ibarra
13,https://www.tripadvisor.com///Hotel_Review-g312858-d3385895-Reviews-Casa_Aida-Ibarra_Imbabura_Province.html,hotel,2022-10-31,Casa Aida,18.0,"La Esperanza, Galo Plaza Lasso # 19-291 Vía a Olmedo Barrio Santa Marianita, Sector del Cuartel Yaguachi, Ibarra 100154 Ecuador",4.5,"Are you looking for a home away from home in Ecuador? Well that is exactly what you will find at this pictures, family run hostel in the heart of the Andes! Accommodation options include camping, dorm style and private rooms. Casa Aida offers delicious home cooked meals, hot showers, free WIFI, and guide services up Volcan Imbabura and other nearby locations!",Excellent,https://www.tripadvisor.com///Hotel_Review-g312858-d3385895-Reviews-Casa_Aida-Ibarra_Imbabura_Province.html,ibarra
14,https://www.tripadvisor.com///Hotel_Review-g312858-d2145910-Reviews-Hotel_Plaza_Victoria-Ibarra_Imbabura_Province.html,hotel,2022-10-31,Hotel Plaza Victoria,55.0,"Bolivar 12-101 YRafael Larrea, Ibarra 100150 Ecuador",3.5,"Looking for a place to stay in Ibarra? Then look no further than Hotel Plaza Victoria, a family-friendly hotel that brings the best of Ibarra to your doorstep.Hotel Plaza Victoria offers guests an array of room amenities including a refrigerator, and getting online is possible, as free wifi is available.The hotel offers room service, to make your visit even more pleasant. The property also features a fitness center and free breakfast. Guests arriving by vehicle have access to free parking.When you’re feeling hungry, be sure to check out Olor a Cafe, La Hacienda Cafe Delicatessen, and La Botica Café, which are some cafes that are popular with locals and out-of-towners alike.Best of all, Hotel Plaza Victoria makes it easy to experience many great Ibarra attractions like Artesanias Ecuatorianas and Arte Colonial, which are some popular art galleries.We’re sure you’ll enjoy your stay at Hotel Plaza Victoria as you experience everything Ibarra has to offer.",Very good,https://www.tripadvisor.com///Hotel_Review-g312858-d2145910-Reviews-Hotel_Plaza_Victoria-Ibarra_Imbabura_Province.html,ibarra
15,https://www.tripadvisor.com///Hotel_Review-g312858-d308807-Reviews-Hotel_Ajavi-Ibarra_Imbabura_Province.html,hotel,2022-10-31,Hotel Ajavi,122.0,"Ave. Mariano Acosta 1638 And Cristobal Gomez Jurado, Ibarra 100150 Ecuador",4.0,"Hotel Ajavi is an excellent choice for travelers visiting Ibarra, offering a family-friendly environment alongside many helpful amenities designed to enhance your stay.Hotel Ajavi features room service and a concierge, to help make your stay more enjoyable. The property also boasts a pool and free breakfast. If you are driving to Hotel Ajavi, free parking is available.If you’re looking for a barbeque restaurant, consider a visit to Chamuyando, Ibérica Ribs, or La Parrilla del Tio Jessy, which are all conveniently located a short distance from Hotel Ajavi.Enjoy your stay in Ibarra!",Very good,https://www.tripadvisor.com///Hotel_Review-g312858-d308807-Reviews-Hotel_Ajavi-Ibarra_Imbabura_Province.html,ibarra
16,https://www.tripadvisor.com///Hotel_Review-g312858-d6961688-Reviews-Hacienda_La_Merced_Baja-Ibarra_Imbabura_Province.html,hotel,2022-10-31,Hacienda La Merced Baja,172.5,"Zuleta, Ibarra 100150 Ecuador",5.0,"Located in the Province of Imbabura, in The Valley of Zuleta, possibly the most beautiful area of the Northern zone of Ecuador; it is only 100 Km North of Quito. The Hacienda remains with all its traditions, respecting their historical and cultural identity. A unique opportunity for those who like to explore one of the best breeding sites of the spanish horse, fighting bulls, and dairy.",Excellent,https://www.tripadvisor.com///Hotel_Review-g312858-d6961688-Reviews-Hacienda_La_Merced_Baja-Ibarra_Imbabura_Province.html,ibarra
18,https://www.tripadvisor.com///Hotel_Review-g312858-d10040594-Reviews-San_Clemente-Ibarra_Imbabura_Province.html,hotel,2022-10-31,San Clemente,96.5,"San Luis de Caranqui, Ibarra 100132 Ecuador",4.5,,Excellent,https://www.tripadvisor.com///Hotel_Review-g312858-d10040594-Reviews-San_Clemente-Ibarra_Imbabura_Province.html,ibarra
21,https://www.tripadvisor.com///Hotel_Review-g312858-d673995-Reviews-Hacienda_Hosteria_Chorlavi-Ibarra_Imbabura_Province.html,hotel,2022-10-31,Hacienda- Hosteria Chorlavi,118.0,"Panamericana km 4. 5, Ibarra 100150 Ecuador",4.5,"ACCOMODATIONS: 50 Rooms with modern bathrooms, 13 of our rooms have chimneys, 23 of our rooms have DirecTV• RESTAURANT SERVICE: National & International Cuisine with ample wine selection • ENTRETAINMENTE every Saturday during lunch hours we have live music and folkloric dances, Indian choreographies with authentic and colorful costumes.• Movie and Karaoke lounge Pool table, darts and fusball, family roomReading areas with peaceful and beautiful scenes• INTERNET SERVICE: Wi-Fi available in all rooms and all areas of the Hacienda• BUSINESS CENTER • SPA",Excellent,https://www.tripadvisor.com///Hotel_Review-g312858-d673995-Reviews-Hacienda_Hosteria_Chorlavi-Ibarra_Imbabura_Province.html,ibarra
28,https://www.tripadvisor.com///Hotel_Review-g312858-d12317026-Reviews-Tunas_y_Cabras-Ibarra_Imbabura_Province.html,hotel,2022-10-31,Tunas y Cabras,268.5,"Llano Grande - Sector Piman Principal, Ibarra 100150 Ecuador",4.0,,Very good,https://www.tripadvisor.com///Hotel_Review-g312858-d12317026-Reviews-Tunas_y_Cabras-Ibarra_Imbabura_Province.html,ibarra
30,https://www.tripadvisor.com///Hotel_Review-g294308-d12997912-Reviews-Eb_Hotel_by_Eurobuilding_Quito-Quito_Pichincha_Province.html,hotel,2022-10-31,Eb Hotel by Eurobuilding Quito,145.0,"Calle 24 de Septiembre S 2-389 Conector Alpachaca, Quito 170907 Ecuador",5.0,"Eb Hotel By Eurobuilding Quito Airport, is the second installment of the EB brand from the Eurobuilding Hotels chain, which is known providing a 5-star service and a luxury design experience throughout all of its 9 properties, located throughout Venezuela, Argentina and the United States. EB Hotel is open Since Octuber 2017. The EB Hotel is located just 8 minutes away from the new Mariscal Sucre International Airport in Quito at the area of Tababela, Metropolitan District of Quito. We are close to the different locations preferred by visitors, 30 minutes away from the city’s historic center and other tourist attractions such as the Andean mountain range, the Cotopaxi volcano and 20 minutes away from the center of the world. Other beautiful landscapes, like the Quilatoa volcano, are easily accessed as well. The hotel has been specially designed for business travelers, tourists and families in general, offering comfort, service and spaces that will inspire you and make your stay a pleasant experience.",Excellent,https://www.tripadvisor.com///Hotel_Review-g294308-d12997912-Reviews-Eb_Hotel_by_Eurobuilding_Quito-Quito_Pichincha_Province.html,ibarra
31,https://www.tripadvisor.com///Hotel_Review-g294308-d15647553-Reviews-Hotel_La_Basilica-Quito_Pichincha_Province.html,hotel,2022-10-31,Hotel La Basilica,149.5,"Venezuela N8-26 y Manabi, Quito 170150 Ecuador",5.0,"Located in a restored colonial house of the 18th century, in the heart of the Historic Center of Quito 100 meters from the Sucre Theater, 200 meters from the Basilica and the presidential palace, close to all the tourist places of interest, monuments, squares, convents, churches and museums. It offers elegant and comfortable rooms with fixed internet connection and free Wi-Fi, telephone, satellite TV, heating, safety box and private bathroom with hot shower, hair dryer. Each room is unique, since they are decorated with different murals hand painted by artists from the Quito school of each church in Quito, the hotel has a classic decoration and furniture of colonial style in wood. Our guests can spend relaxing moments in our two patios, having a delicious breakfast with fresh fruit, or reading a book next to a beautiful vertical garden with a waterfall, from our viewpoint you can enjoy a 360 degree view of the entire center historical or visit our craft store.",Excellent,https://www.tripadvisor.com///Hotel_Review-g294308-d15647553-Reviews-Hotel_La_Basilica-Quito_Pichincha_Province.html,ibarra
