,link,tipo,fecha_view,nombre_id,precio,direccion,puntuacion,descripcion,calficacion_tx,sitio_web,ciudad
0,https://www.tripadvisor.com///Hotel_Review-g297538-d5985355-Reviews-Mantahost_Hotel-Manta_Manabi_Province.html,hotel,2022-10-31,Mantahost Hotel,148.5,"Km 1.5 Via Barbasquillo, Manta 130802 Ecuador",4.5,"With its oceanfront location just 4 km from Manta city, MantaHost Hotel provides accommodation with balconies offering Pacific Ocean views. It features an outdoor swimming pool. The hotel's restaurant serves a daily buffet breakfast and regional and international dishes during the evening. A free welcome drink and exotic cocktails are served in the lobby bar. Free private parking is possible at the MantaHost and a shuttle service is available upon request. Eloy Alfaro de Manta Airport is a 25-minute drive from the hotel.",Excellent,https://www.tripadvisor.com///Hotel_Review-g297538-d5985355-Reviews-Mantahost_Hotel-Manta_Manabi_Province.html,manta
1,https://www.tripadvisor.com///Hotel_Review-g297538-d668015-Reviews-Balandra_Hotel-Manta_Manabi_Province.html,hotel,2022-10-31,Balandra Hotel,114.5,"Calle 20 y Avenida 7 Barrio Cordoba, Manta 130802 Ecuador",4.5,"The best hotel in Manta with first class service, surrounded by nature and with a pefect location for tourists or business guests.",Excellent,https://www.tripadvisor.com///Hotel_Review-g297538-d668015-Reviews-Balandra_Hotel-Manta_Manabi_Province.html,manta
2,https://www.tripadvisor.com///Hotel_Review-g297538-d8548933-Reviews-Hotel_Poseidon-Manta_Manabi_Province.html,hotel,2022-10-31,Hotel Poseidon,147.0,"Via Barbasquillo km 1. 5, Manta 130802 Ecuador",4.0,"Finding an ideal luxury hotel in Manta does not have to be difficult. Welcome to Hotel Poseidon, a nice option for travelers like you.Hotel Poseidon offers guests an array of room amenities including a minibar and air conditioning, and getting online is possible, as free wifi is available.The hotel offers a 24 hour front desk, room service, and baggage storage, to make your visit even more pleasant. The property also features a pool and a poolside bar. Guests arriving by vehicle have access to free parking.If you’re looking for a seafood restaurant, consider a visit to El Resero Rincón Argentino, Finisterre, or Restaurante Las Velas CÍA LTDA, which are all conveniently located a short distance from Hotel Poseidon.Best of all, Hotel Poseidon makes it easy to experience some great Manta attractions like Museo del Banco Central, which is a popular history museum.Hotel Poseidon puts the best of Manta at your fingertips, making your stay both relaxing and enjoyable.",Very good,https://www.tripadvisor.com///Hotel_Review-g297538-d8548933-Reviews-Hotel_Poseidon-Manta_Manabi_Province.html,manta
3,https://www.tripadvisor.com///Hotel_Review-g297538-d1098541-Reviews-Hotel_Vistalmar_by_Zigo-Manta_Manabi_Province.html,hotel,2022-10-31,Hotel Vistalmar by Zigo,108.0,"Calle M1 y Av. 24 Playa Murcielago, Manta 130802 Ecuador",4.0,"Located in the heart of Manta, Ecuador. It is a small boutique hotel with privileged pacific ocean view, it was built on top of a cliff next to the most modern and new skyline of the city. It is a quite and private hotel that offers our guest the opportunity to relax and enjoy of the sun and the warm Ecuadorian weather. Vistalmar Hotel is steps away from Murcielago Beach and walking distance from banks, supermarkets, restaurants and bars. Manta's international airport is no more than 10 minutes away on car and Manta's port is less than 5 minutes away. Enjoy whale watching, ocean view pool, diving, year long Ecuadorian warm weather on this small but precious boutique Hotel. All of our rooms are equipped with satellite TV, WiFi, modern and spacious accommodations.",Very good,https://www.tripadvisor.com///Hotel_Review-g297538-d1098541-Reviews-Hotel_Vistalmar_by_Zigo-Manta_Manabi_Province.html,manta
4,https://www.tripadvisor.com///Hotel_Review-g297538-d12148845-Reviews-Wyndham_Manta_Sail_Plaza_Hotel_and_Convention_Center-Manta_Manabi_Province.html,hotel,2022-10-31,Wyndham Manta Sail Plaza Hotel and Convention Center,162.0,"Via a Barbasquillo Km 1. 7, Manta 130802 Ecuador",4.0,"The most important Pacific Coast hotel, the Wyndham Manta Sail Plaza & Convention Center is located in front of the sea in the Port of Manta, one of the most important Ports in Ecuador. Surrounded by wonderful beaches, the hotel has two restaurants, one All-Inclusive and one Executive. Two bars are near the restaurants. Also, one pool bar, an outdoor pool and a kid’s pool. Our Convention Center has 14 meeting rooms, capacity until 3000 thousand people. A complete game room for children and adults, our discotheque and karaoke will be part of your stay.",Very good,https://www.tripadvisor.com///Hotel_Review-g297538-d12148845-Reviews-Wyndham_Manta_Sail_Plaza_Hotel_and_Convention_Center-Manta_Manabi_Province.html,manta
5,https://www.tripadvisor.com///Hotel_Review-g297538-d7168603-Reviews-Hostal_Casa_Umina-Manta_Manabi_Province.html,hotel,2022-10-31,Hostal Casa Umina,47.5,"Flavio Reyes y Calle 31 Next to Cafelito, Manta 130215 Ecuador",4.5,"Confortables rooms, AC, warm water, free Wi Fi, free private parking, situated at the end of Ave. Flavio Reyes in the way to the luxury hostel like sail plaza of whyndham, Poseido and Manta Host. Close to the most beautiful beaches and shopping malls. From $ 40 per person incluiding multiple Accommodation",Excellent,https://www.tripadvisor.com///Hotel_Review-g297538-d7168603-Reviews-Hostal_Casa_Umina-Manta_Manabi_Province.html,manta
6,https://www.tripadvisor.com///Hotel_Review-g297538-d4227539-Reviews-Hotel_Perla_Spondylus-Manta_Manabi_Province.html,hotel,2022-10-31,Hotel Perla Spondylus,118.0,"Calle 15 y Avenida 3, Manta 130802 Ecuador",4.0,"Spondylus Perla Hotel is located in the heart of Manta , 100 meters from the financial district and 500 meters from Playa El Murcielago and Manta Cultural Museum. It is 10 minutes drive from Eloy Alfaro Airport and 30 minutes from Montecristi. Offers breakfast , wifi and is a complimentary parking . Comfortable suites and rooms. Some with large windows overlooking the sea. There are elevator and 2 rooms for disabled guests . Business center and meeting rooms and conferences. Our La Perla Restaurant serves regional specialties.",Very good,https://www.tripadvisor.com///Hotel_Review-g297538-d4227539-Reviews-Hotel_Perla_Spondylus-Manta_Manabi_Province.html,manta
7,https://www.tripadvisor.com///Hotel_Review-g3205055-d1925068-Reviews-Villa_Kite_Resort-Santa_Marianita_Manta_Manabi_Province.html,hotel,2022-10-31,Villa Kite Resort,89.5,"Av Malecoon s/n Playa Santa Marianita, Santa Marianita, Manta 130852 Ecuador",3.5,"We are located at Santa Marianita`s beach, beside hotel service we also offer restaurant & bar services, we have our own Kitesurf, S.U.P and Surf School. Regarding our rooms, we have several options available (depending of number of people), they all have private bathroom and air conditioning. During your stay guests can make use of our facilities: open wi-fi, swimming poor for adults & children, bar, pool and our front sea cabin.",Very good,https://www.tripadvisor.com///Hotel_Review-g3205055-d1925068-Reviews-Villa_Kite_Resort-Santa_Marianita_Manta_Manabi_Province.html,manta
8,https://www.tripadvisor.com///Hotel_Review-g297538-d6548618-Reviews-Hostal_Blue_Pacific-Manta_Manabi_Province.html,hotel,2022-10-31,Hostal Blue Pacific,59.0,"Av Flavio Reyes y calle 29 # 2806, Manta 130802 Ecuador",4.5,"The Pacific Blue Inn is a new concept in accommodation that offers accommodation with spacious, modern and comfortable rooms; creating the perfect marriage of comfort and accessibility. Its privileged location allows you to be a few steps bat beach, restaurants, bars, clubs, airlines and AEROGAL agencies as tame, near the shopping blanket,-financial area and downtown, 10 minutes from Eloy Alfaro Airport. For a charming, romantic an innovative guest nights and warm people. Manta is always brilliant magic, color and charm to give visitors a fascinating experience.",Excellent,https://www.tripadvisor.com///Hotel_Review-g297538-d6548618-Reviews-Hostal_Blue_Pacific-Manta_Manabi_Province.html,manta
9,https://www.tripadvisor.com///Hotel_Review-g297538-d7245670-Reviews-Hostal_Casa_Latina-Manta_Manabi_Province.html,hotel,2022-10-31,Hostal Casa Latina,45.0,"Calle 26 Avenida Flavio Reyes, Manta 130802 Ecuador",3.5,"Looking for a place to stay in Manta? Then look no further than Hostal Casa Latina, a family-friendly inn that brings the best of Manta to your doorstep.Hostal Casa Latina is a family-friendly inn offering air conditioning in the rooms, and it is easy to stay connected during your stay as free wifi is offered to guests.The inn features a 24 hour front desk, room service, and a sun terrace. Plus, guests can enjoy a lounge, which has made this a popular choice among travelers visiting Manta. For guests with a vehicle, a parking garage is available.When you’re feeling hungry, be sure to check out Princeps Restaurante, which is a Mediterranean restaurant that is popular with locals and out-of-towners alike.Best of all, Hostal Casa Latina makes it easy to experience some great Manta attractions like Museo del Banco Central, which is a popular history museum.We’re sure you’ll enjoy your stay at Hostal Casa Latina as you experience everything Manta has to offer.",Very good,https://www.tripadvisor.com///Hotel_Review-g297538-d7245670-Reviews-Hostal_Casa_Latina-Manta_Manabi_Province.html,manta
10,https://www.tripadvisor.com///Hotel_Review-g3205055-d12122486-Reviews-Soga_Hostal-Santa_Marianita_Manta_Manabi_Province.html,hotel,2022-10-31,Soga Hostal,41.5,"Ruta del Spondylus 0, Santa Marianita, Manta 130852 Ecuador",5.0,"Relaxing and peaceful place, where you can have a awesome time, do online work, watch tv, go to the beach, do kite surf, or just stay in the hammocks. We have diferents type of rooms and the prices vary depending of the services, the basic rooms has a share bathrroms with fan, we also have rooms with private bathrooms, rooms with tv and a/c, etc. Santa Marianita is a beach where local people are dedicated to fishing, people are friendly, it is a safe and very quiet place. The space Soga Lounge is a hostel in playa santa marianita has Rustico style rooms of wood and bamboo, we have different types of rooms the simplest have double bed, fan and shared bathroom, we also have rooms with private bathroom, a / c, upon request of customers. We have hamacas area where you can work on your computer, phone, tablet, etc, you can also rest, go to the beach or maybe see tv in the comunal area. Guest access comunal tv, hamacks, kitchen all that you can use at no cost Interaction with guests",Excellent,https://www.tripadvisor.com///Hotel_Review-g3205055-d12122486-Reviews-Soga_Hostal-Santa_Marianita_Manta_Manabi_Province.html,manta
11,https://www.tripadvisor.com///Hotel_Review-g297538-d1169001-Reviews-Antares_Hostal-Manta_Manabi_Province.html,hotel,2022-10-31,Antares Hostal,65.5,"Av. Flavio Reyes y Calle 29, Manta 130802 Ecuador",3.5,"Antares Hotel & Spa, is a place created to make you feel like home, in some way you will be at a family house, but with the hotel services. We are near to the beach, airport and down town, but far away from the noise.",Very good,https://www.tripadvisor.com///Hotel_Review-g297538-d1169001-Reviews-Antares_Hostal-Manta_Manabi_Province.html,manta
12,https://www.tripadvisor.com///Hotel_Review-g297538-d23682401-Reviews-Hotel_Voyager_Manta-Manta_Manabi_Province.html,hotel,2022-10-31,Hotel Voyager Manta,56.5,"Calle 24 A Esquina Avenida M2, Manta 130802 Ecuador",4.0,,Very good,https://www.tripadvisor.com///Hotel_Review-g297538-d23682401-Reviews-Hotel_Voyager_Manta-Manta_Manabi_Province.html,manta
13,https://www.tripadvisor.com///Hotel_Review-g297538-d12637161-Reviews-Hotel_Rishuo-Manta_Manabi_Province.html,hotel,2022-10-31,Hotel Rishuo,85.0,"Calle Principal Av. Colon Playa de Santa Marianita, Manta 130852 Ecuador",4.5,"Featuring free WiFi throughout the property, Hotel Rishuo is located in Santa Marianita in Manta, 14 km from Murcielago Beach. The hotel has an year-round outdoor pool, and guests can enjoy a meal at the restaurant. Free private parking is available on site. The rooms come with a flat-screen TV with cable channels. All the rooms have sea view.",Excellent,https://www.tripadvisor.com///Hotel_Review-g297538-d12637161-Reviews-Hotel_Rishuo-Manta_Manabi_Province.html,manta
14,https://www.tripadvisor.com///Hotel_Review-g297538-d6684166-Reviews-Hostal_Rosa_Mar-Manta_Manabi_Province.html,hotel,2022-10-31,Hostal Rosa Mar,30.5,"Av. 4 de Noviembre entre Calle 319-320, Manta 130802 Ecuador",4.0,"Welcome to Hostal Rosa Mar, your Manta “home away from home.” Hostal Rosa Mar aims to make your visit as relaxing and enjoyable as possible, which is why so many guests continue to come back year after year.Free wifi is offered to guests, and rooms at Hostal Rosa Mar offer air conditioning.During your stay, take advantage of some of the amenities offered, including a 24 hour front desk and a coffee shop. Guests of Hostal Rosa Mar are also welcome to enjoy a snack bar, located on site. For travelers arriving by car, a parking garage is available.If you like seafood restaurants, Hostal Rosa Mar is conveniently located near Picanteria El Marino, Alcatraz, and Finisterre.Hostal Rosa Mar puts the best of Manta at your fingertips, making your stay both relaxing and enjoyable.",Very good,https://www.tripadvisor.com///Hotel_Review-g297538-d6684166-Reviews-Hostal_Rosa_Mar-Manta_Manabi_Province.html,manta
15,https://www.tripadvisor.com///Hotel_Review-g297538-d6548618-Reviews-Hostal_Blue_Pacific-Manta_Manabi_Province.html,hotel,2022-10-31,Hostal Blue Pacific,59.0,"Av Flavio Reyes y calle 29 # 2806, Manta 130802 Ecuador",4.5,"The Pacific Blue Inn is a new concept in accommodation that offers accommodation with spacious, modern and comfortable rooms; creating the perfect marriage of comfort and accessibility. Its privileged location allows you to be a few steps bat beach, restaurants, bars, clubs, airlines and AEROGAL agencies as tame, near the shopping blanket,-financial area and downtown, 10 minutes from Eloy Alfaro Airport. For a charming, romantic an innovative guest nights and warm people. Manta is always brilliant magic, color and charm to give visitors a fascinating experience.",Excellent,https://www.tripadvisor.com///Hotel_Review-g297538-d6548618-Reviews-Hostal_Blue_Pacific-Manta_Manabi_Province.html,manta
16,https://www.tripadvisor.com///Hotel_Review-g297538-d12912952-Reviews-El_Naufrago-Manta_Manabi_Province.html,hotel,2022-10-31,El Naufrago,25.5,"Circunvalacion Arcadio Dias, lote 22, manzana U, Manta 999999 Ecuador",3.5,"Set in Manta, 1.4 km from Barbasquillo, Hostal El Naufrago 1 offers accommodation with a bar, free private parking, a shared lounge and a garden. Featuring room service, this property also provides guests with a barbecue.",Very good,https://www.tripadvisor.com///Hotel_Review-g297538-d12912952-Reviews-El_Naufrago-Manta_Manabi_Province.html,manta
17,https://www.tripadvisor.com///Hotel_Review-g297538-d3699670-Reviews-Hotel_Mar_Azul-Manta_Manabi_Province.html,hotel,2022-10-31,Hotel Mar Azul,105.5,"Calle 22 y Avenida 8 Ingresando por la av. Flavio Reyes, Manta 130802 Ecuador",3.5,"Looking for a place to stay in Manta? Then look no further than Hotel Mar Azul, a small hotel that brings the best of Manta to your doorstep.Hotel Mar Azul is a small hotel offering air conditioning, a minibar, and a refrigerator in the rooms, and it is easy to stay connected during your stay as free wifi is offered to guests.The small hotel features a 24 hour front desk, room service, and a concierge. Plus, guests can enjoy a pool and free breakfast, which have made this a popular choice among travelers visiting Manta. For guests with a vehicle, free parking is available.While in Manta, you may want to check out some of the restaurants that are a short walk away from Hotel Mar Azul, including Restaurante Martinica (0.9 mi), Restaurante Las Velas CÍA LTDA (0.2 mi), and Finisterre (0.5 mi).If you’re looking for something to do, Museo del Banco Central (0.2 mi) is a nice way to spend some time, and it is within walking distance of Hotel Mar Azul.We’re sure you’ll enjoy your stay at Hotel Mar Azul as you experience everything Manta has to offer.",Very good,https://www.tripadvisor.com///Hotel_Review-g297538-d3699670-Reviews-Hotel_Mar_Azul-Manta_Manabi_Province.html,manta
18,https://www.tripadvisor.com///Hotel_Review-g297538-d7224461-Reviews-Hostal_Manakin-Manta_Manabi_Province.html,hotel,2022-10-31,Hostal Manakin,73.0,"Street 20 Avn 12( Next to TV Cable), Manta 130802 Ecuador",3.5,"Hostal Manakin is a small and comfortable place that ofter economic and reasonable prices, our rooms are always clean and provided with free Wi-Fi, air conditioner, private bathrooms that have free shampoo and soap, TV, room service, daily cleaning. We expect you to relax in our garden and to work out in the gym (which is free) next door, and to enjoy a pleasant walk in the beach.",Very good,https://www.tripadvisor.com///Hotel_Review-g297538-d7224461-Reviews-Hostal_Manakin-Manta_Manabi_Province.html,manta
19,https://www.tripadvisor.com///Hotel_Review-g297538-d12436689-Reviews-Manta_Airport_Hotel-Manta_Manabi_Province.html,hotel,2022-10-31,Manta Airport Hotel,56.0,"Via al Palmar, Manta 130802 Ecuador",4.0,"Set in Manta, 7.4 km from Manta Harbour, Manta Airport Hotel offers accommodation with a restaurant, free private parking, an outdoor swimming pool and a shared lounge.",Very good,https://www.tripadvisor.com///Hotel_Review-g297538-d12436689-Reviews-Manta_Airport_Hotel-Manta_Manabi_Province.html,manta
20,https://www.tripadvisor.com///Hotel_Review-g297538-d12930788-Reviews-Hotel_Oceanik-Manta_Manabi_Province.html,hotel,2022-10-31,Hotel Oceanik,47.0,"Calle 15 avenida 10 y 11, Manta 130802 Ecuador",4.0,"If you’re looking for a guest house in Manta, look no further than Hotel Oceanik.Guest rooms offer air conditioning, and Hotel Oceanik makes getting online easy as free wifi is available.You can also take advantage of some of the amenities offered by the guest house, including a 24 hour front desk and baggage storage. In addition, guests can enjoy a hot tub and an on-site restaurant during their visit. As an added convenience, there is free private parking available nearby.While you’re here, be sure to check out Princeps Restaurante, one of the Mediterranean restaurants that can be found in Manta, which is a short distance from Hotel Oceanik.Plus, during your trip, don't forget to check out Museo del Banco Central (0.5 mi), a popular attraction that is within walking distance of Hotel Oceanik.The staff at Hotel Oceanik looks forward to serving you during your upcoming visit.",Very good,https://www.tripadvisor.com///Hotel_Review-g297538-d12930788-Reviews-Hotel_Oceanik-Manta_Manabi_Province.html,manta
21,https://www.tripadvisor.com///Hotel_Review-g297538-d7021232-Reviews-Hotel_Los_Almendros-Manta_Manabi_Province.html,hotel,2022-10-31,Hotel Los Almendros,107.0,"Calle 17 y Avenida 22, Manta 130802 Ecuador",3.5,"Hotel close to everything, especially if you are traveling on business, comfortable and elegant with high speed internet access. If you like to do exercise in the morning or swim you can do so in our gym or pool. Breakfast in our restaurant from 6:30 am and do not preocuopes because included.",Very good,https://www.tripadvisor.com///Hotel_Review-g297538-d7021232-Reviews-Hotel_Los_Almendros-Manta_Manabi_Province.html,manta
22,https://www.tripadvisor.com///Hotel_Review-g297538-d13360850-Reviews-Hotel_Stella_Blu-Manta_Manabi_Province.html,hotel,2022-10-31,Hotel Stella Blu,46.5,"Avenida Universidad 4 Calle Universidad 7, Manta 130802 Ecuador",5.0,"Looking for a place to stay in Manta? Then look no further than Stella Blu, a small hotel that brings the best of Manta to your doorstep.Guest rooms offer amenities such as a flat screen TV, a kitchenette, and air conditioning, and guests can go online with free wifi offered by the small hotel.The property also boasts a pool and free breakfast, to help make your stay more enjoyable. If you are driving to Stella Blu, free parking is available.While you’re here, be sure to check out Princeps Restaurante, one of the Mediterranean restaurants that can be found in Manta, which is a short distance from Stella Blu.Looking to explore? Then look no further than Museo del Banco Central (0.8 mi), which is a popular Manta attraction – and it is conveniently located within walking distance of the small hotel.We’re sure you’ll enjoy your stay at Stella Blu as you experience everything Manta has to offer.",Excellent,https://www.tripadvisor.com///Hotel_Review-g297538-d13360850-Reviews-Hotel_Stella_Blu-Manta_Manabi_Province.html,manta
23,https://www.tripadvisor.com///Hotel_Review-g297538-d6375203-Reviews-Golden_Mar_Hospedaje_Lodging-Manta_Manabi_Province.html,hotel,2022-10-31,Golden Mar Hospedaje - Lodging,64.0,"Ave. M1 y Calle 24 Frente al Ed. Santorini, Manta 130802 Ecuador",3.5,,Very good,https://www.tripadvisor.com///Hotel_Review-g297538-d6375203-Reviews-Golden_Mar_Hospedaje_Lodging-Manta_Manabi_Province.html,manta
24,https://www.tripadvisor.com///Hotel_Review-g297538-d17574650-Reviews-Hostal_Malania-Manta_Manabi_Province.html,hotel,2022-10-31,Hostal Malania,31.5,"Next to the IESS Hospital Just Behind SECAP, Manta 130802 Ecuador",4.0,"Boasting a garden, terrace, shared lounge and free WiFi, Hostal Malania is located in Manta, 6.4 km from Murciélago Beach and 3.3 km from Manta Harbour. Featuring a 24-hour front desk, this property also provides guests with a children's playground.",Very good,https://www.tripadvisor.com///Hotel_Review-g297538-d17574650-Reviews-Hostal_Malania-Manta_Manabi_Province.html,manta
25,https://www.tripadvisor.com///Hotel_Review-g297538-d8101122-Reviews-Hostal_Pikeiro_Blue-Manta_Manabi_Province.html,hotel,2022-10-31,Hostal Pikeiro Blue,42.5,"Via al Palmar, Detras de Manta Auto, Diagonal a la nueva terminal terrestre, a 3 minutos del aeropuerto Eloy Alfaro de Manta., Manta 130801 Ecuador",3.5,"Hotel Pikeiro Blue is located in Manta and offers an outdoor swimming pool. Free WiFi access and free private parking are available here. Each room at Hotel Pikeiro Blue includes a flat-screen cable TV, a closet and a private bathroom with a shower.",Very good,https://www.tripadvisor.com///Hotel_Review-g297538-d8101122-Reviews-Hostal_Pikeiro_Blue-Manta_Manabi_Province.html,manta
26,https://www.tripadvisor.com///Hotel_Review-g297538-d4296751-Reviews-Apart_Hotel_Hamilton-Manta_Manabi_Province.html,hotel,2022-10-31,Apart Hotel Hamilton,67.0,"Calle Universitaria 10, Manta 130214 Ecuador",3.5,"Hotel Hamilton is an excellent choice for travelers visiting Manta, offering a luxury environment alongside many helpful amenities designed to enhance your stay.Guest rooms offer a flat screen TV, air conditioning, and a minibar, and Hotel Hamilton makes getting online easy as free wifi is available.You can also take advantage of some of the amenities offered by the small hotel, including room service. In addition, guests can enjoy a pool and an on-site restaurant during their visit.Manta has plenty of seafood restaurants. So when you’re here, be sure to check out popular spots like Finisterre, El Resero Rincón Argentino, and Restaurante Las Velas CÍA LTDA, which are serving up some great dishes.If you’re looking for something to do, Museo del Banco Central (0.9 mi) is a nice way to spend some time, and it is within walking distance of Hotel Hamilton.Enjoy your stay in Manta!",Very good,https://www.tripadvisor.com///Hotel_Review-g297538-d4296751-Reviews-Apart_Hotel_Hamilton-Manta_Manabi_Province.html,manta
27,https://www.tripadvisor.com///Hotel_Review-g297538-d7245670-Reviews-Hostal_Casa_Latina-Manta_Manabi_Province.html,hotel,2022-10-31,Hostal Casa Latina,45.0,"Calle 26 Avenida Flavio Reyes, Manta 130802 Ecuador",3.5,"Looking for a place to stay in Manta? Then look no further than Hostal Casa Latina, a family-friendly inn that brings the best of Manta to your doorstep.Hostal Casa Latina is a family-friendly inn offering air conditioning in the rooms, and it is easy to stay connected during your stay as free wifi is offered to guests.The inn features a 24 hour front desk, room service, and a sun terrace. Plus, guests can enjoy a lounge, which has made this a popular choice among travelers visiting Manta. For guests with a vehicle, a parking garage is available.When you’re feeling hungry, be sure to check out Princeps Restaurante, which is a Mediterranean restaurant that is popular with locals and out-of-towners alike.Best of all, Hostal Casa Latina makes it easy to experience some great Manta attractions like Museo del Banco Central, which is a popular history museum.We’re sure you’ll enjoy your stay at Hostal Casa Latina as you experience everything Manta has to offer.",Very good,https://www.tripadvisor.com///Hotel_Review-g297538-d7245670-Reviews-Hostal_Casa_Latina-Manta_Manabi_Province.html,manta
