,link,tipo,fecha_view,nombre_id,precio,direccion,puntuacion,descripcion,calficacion_tx,sitio_web,ciudad
32,https://www.tripadvisor.com///Hotel_Review-g294308-d12997912-Reviews-Eb_Hotel_by_Eurobuilding_Quito-Quito_Pichincha_Province.html,hotel,2022-10-31,Eb Hotel by Eurobuilding Quito,145.0,"Calle 24 de Septiembre S 2-389 Conector Alpachaca, Quito 170907 Ecuador",5.0,"Eb Hotel By Eurobuilding Quito Airport, is the second installment of the EB brand from the Eurobuilding Hotels chain, which is known providing a 5-star service and a luxury design experience throughout all of its 9 properties, located throughout Venezuela, Argentina and the United States. EB Hotel is open Since Octuber 2017. The EB Hotel is located just 8 minutes away from the new Mariscal Sucre International Airport in Quito at the area of Tababela, Metropolitan District of Quito. We are close to the different locations preferred by visitors, 30 minutes away from the city’s historic center and other tourist attractions such as the Andean mountain range, the Cotopaxi volcano and 20 minutes away from the center of the world. Other beautiful landscapes, like the Quilatoa volcano, are easily accessed as well. The hotel has been specially designed for business travelers, tourists and families in general, offering comfort, service and spaces that will inspire you and make your stay a pleasant experience.",Excellent,https://www.tripadvisor.com///Hotel_Review-g294308-d12997912-Reviews-Eb_Hotel_by_Eurobuilding_Quito-Quito_Pichincha_Province.html,ibarra
33,https://www.tripadvisor.com///Hotel_Review-g294308-d12988213-Reviews-Old_Town_Quito_Suites-Quito_Pichincha_Province.html,hotel,2022-10-31,Old Town Quito Suites,141.5,"Jose De Antepara E3 61 Y Vicente Leon Vincente Leon, Quito 170136 Ecuador",5.0,"This unique colonial building was restored with great care by re-integrating the original building elements such as the original windows, doors, handles, etc. The use of paint techniques, unique colours and vintage elements give the whole a breathtaking appearance but at the same time radiate a sense of tranquillity. You can look around for hours and enjoy the many details and ingenious elements, unique and different in each flat. The highly personalised approach of the staff makes your stay very special. Their advice on local experiences, tasting unique dishes or discovering lesser-known tourist places is why Old Town Quito Suites is one of the most chosen hotels in Quito.",Excellent,https://www.tripadvisor.com///Hotel_Review-g294308-d12988213-Reviews-Old_Town_Quito_Suites-Quito_Pichincha_Province.html,ibarra
0,https://www.tripadvisor.com///Hotel_Review-g644406-d10342534-Reviews-Hotel_Oro_Verde_Loja-Loja_Loja_Province.html,hotel,2022-10-31,Hotel Oro Verde Loja,72.0,"De Noviembre & José Antonio Eguiguren 18, Loja 110110 Ecuador",5.0,,Excellent,https://www.tripadvisor.com///Hotel_Review-g644406-d10342534-Reviews-Hotel_Oro_Verde_Loja-Loja_Loja_Province.html,loja
1,https://www.tripadvisor.com///Hotel_Review-g644406-d7027537-Reviews-Hostal_Los_Lirios-Loja_Loja_Province.html,hotel,2022-10-31,Hostal Los Lirios,28.0,"Jose Maria Pena 09-59 e/ Miguel Riofrio y Rocafuerte, Loja 110150 Ecuador",4.0,"Hostal Los Lirios is an excellent choice for travelers visiting Loja, offering a romantic environment alongside many helpful amenities designed to enhance your stay.Plaza Parque Central (2.3 mi), located nearby, makes Hostal Los Lirios a great place to stay for those interested in visiting this popular Loja landmark.Hostal Los Lirios features a 24 hour front desk. Guests arriving by vehicle have access to free parking.While in Loja be sure to experience local tapas favorites at Topoli Cafe.If you are interested in exploring Loja, check out a historic site, such as Puerta de la Ciudad.Enjoy your stay in Loja!",Very good,https://www.tripadvisor.com///Hotel_Review-g644406-d7027537-Reviews-Hostal_Los_Lirios-Loja_Loja_Province.html,loja
2,https://www.tripadvisor.com///Hotel_Review-g644406-d2614603-Reviews-Hostal_Achik_Wasi-Loja_Loja_Province.html,hotel,2022-10-31,Hostal Achik Wasi,39.0,"Calle Inti Nan S/N. Barrio La Luz, Loja 110105 Ecuador",4.0,,Very good,https://www.tripadvisor.com///Hotel_Review-g644406-d2614603-Reviews-Hostal_Achik_Wasi-Loja_Loja_Province.html,loja
3,https://www.tripadvisor.com///Hotel_Review-g644406-d3244649-Reviews-Zamorano_Real_Hotel-Loja_Loja_Province.html,hotel,2022-10-31,Zamorano Real Hotel,66.5,"Miguel Riofrio 14-62 entre Sucre y Bolivar, Loja 110150 Ecuador",4.0,"Zamorano Real hotel is located in the down town of Loja, where converge financial centers, goverment centers and religious centers. And also enjoy our delicious food.",Very good,https://www.tripadvisor.com///Hotel_Review-g644406-d3244649-Reviews-Zamorano_Real_Hotel-Loja_Loja_Province.html,loja
4,https://www.tripadvisor.com///Hotel_Review-g644406-d3355632-Reviews-Hotel_Podocarpus-Loja_Loja_Province.html,hotel,2022-10-31,Hotel Podocarpus,49.5,"Jose Antonio Eguiguren 1650 y 18 de Noviembre, Loja 110150 Ecuador",3.5,"The Hotel Podocarpus invited to join us and enjoy our most precious treasure, the HospitalidadContamos an unbeatable location in the heart of the city of Loja, a few steps from commercial and financial cultural buildings, religious, and we counted on a wide, modern and delicately infrastructure right for you with a warm and relaxing very comfortable environment without hesitation Podocarpus Hotel is definitely the ideal place for the sophisticated traveler Loja",Very good,https://www.tripadvisor.com///Hotel_Review-g644406-d3355632-Reviews-Hotel_Podocarpus-Loja_Loja_Province.html,loja
5,https://www.tripadvisor.com///Hotel_Review-g644406-d2689725-Reviews-Grand_Hotel_Loja-Loja_Loja_Province.html,hotel,2022-10-31,Grand Hotel Loja,38.5,"Av. Manuel Agustin Aguirre y Rocafuerte esquina, Loja 110150 Ecuador",3.5,"The Grand Hotel Loja has comfortable and spacious rooms, suites, with private bathroom, cable TV, unlimited WIFI internet, room service, cafeteria, restaurant, rooms for all kinds of events, business center, laundry, private parking and more services for you to your stay is pleasant, our hotel is in the center of the city of Loja and 40 minutes from the airport in the city of Catmayo. The Grand Hotel Loja is the best place to stay in the city of Loja and fully enjoy our hospitality, quality and personalized service. Taste our typical foods such as Repe Lojano, cecina, mil con quesilo and a delicious horchata, meals that we prepare with the high quality, hygiene and service that characterizes us. They undoubtedly make the Grand Hotel Loja an obligatory stop for national and international tourists.",Very good,https://www.tripadvisor.com///Hotel_Review-g644406-d2689725-Reviews-Grand_Hotel_Loja-Loja_Loja_Province.html,loja
6,https://www.tripadvisor.com///Hotel_Review-g644406-d11776034-Reviews-El_Cardenal_Hotel-Loja_Loja_Province.html,hotel,2022-10-31,El Cardenal Hotel,30.5,"Calle Gladiolos Av. 18 de Noviembre, Loja 110150 Ecuador",4.5,"The Cardenal Hotel is a quiet place, comfortable and full of peace together with nature. ¡I love this place!... I can walk or cycle along the river, breathe fresh air. Everything is near like banks, shopping centers, market, restaurants, parks, mountains and rivers. ¡Awesome!",Excellent,https://www.tripadvisor.com///Hotel_Review-g644406-d11776034-Reviews-El_Cardenal_Hotel-Loja_Loja_Province.html,loja
7,https://www.tripadvisor.com///Hotel_Review-g644406-d12544722-Reviews-La_Casa_de_Manuel_Casa_Boutique-Loja_Loja_Province.html,hotel,2022-10-31,La Casa de Manuel Casa-Boutique,52.0,"Sucre 14-84 Y Cariamanga, Loja 110102 Ecuador",5.0,,Excellent,https://www.tripadvisor.com///Hotel_Review-g644406-d12544722-Reviews-La_Casa_de_Manuel_Casa_Boutique-Loja_Loja_Province.html,loja
8,https://www.tripadvisor.com///Hotel_Review-g644406-d12215918-Reviews-Hotel_Virgen_del_Cisne_en_Loja-Loja_Loja_Province.html,hotel,2022-10-31,Hotel Virgen del Cisne en Loja,29.0,"Colon Ramon Pinto esquina, diagonal al Parque Bolivar, Loja 110101 Ecuador",4.5,"Hotel Virgen del Cisne en Loja- Ecuador un lugar acogedor. Un hotel económico en Loja, desde $15.00 por persona con ambiente hogareño, donde sentirá la maravillosa experiencia de tener una ""familia en Loja""... Recorra con nosotros los lugares turísticos de Loja y su provincia: Parque Eólico, Parque Podocarpus, Parque Jipiro, Santuario del Cisne, Vilcabamba, etc,..",Excellent,https://www.tripadvisor.com///Hotel_Review-g644406-d12215918-Reviews-Hotel_Virgen_del_Cisne_en_Loja-Loja_Loja_Province.html,loja
9,https://www.tripadvisor.com///Hotel_Review-g644406-d1743589-Reviews-Grand_Victoria_Boutique_Hotel-Loja_Loja_Province.html,hotel,2022-10-31,Grand Victoria Boutique Hotel,81.0,"Bernardo Valdivieso 06-50 Entre Jose Antonio Eguiguren y Colon, Loja 110101 Ecuador",4.0,"The first hotel of luxury in the city. Located in the main part of the historical center of Loja, like a large house of the republican architecture and of familiar inheritance, it gathers the magnitude of the time of principles of century XX. Comfort, originality, professional service and an enviable location, are some of the multiple qualities and benefits that the guest will be able to find in our hotel.",Very good,https://www.tripadvisor.com///Hotel_Review-g644406-d1743589-Reviews-Grand_Victoria_Boutique_Hotel-Loja_Loja_Province.html,loja
10,https://www.tripadvisor.com///Hotel_Review-g644406-d7229676-Reviews-Hotel_Villonaco_Loja-Loja_Loja_Province.html,hotel,2022-10-31,Hotel Villonaco Loja,36.0,"Sucre 201-41 entre 10 de Agosto y Jose Antonio Eguiguren, Loja 110150 Ecuador",4.5,"Welcome to Hotel Villonaco Loja, your Loja “home away from home.” Hotel Villonaco Loja aims to make your visit as relaxing and enjoyable as possible, which is why so many guests continue to come back year after year.While staying at Hotel Villonaco Loja, visitors can check out Plaza Parque Central (2.1 mi), which is a popular Loja attraction.Hotel Villonaco Loja is a family-friendly small hotel offering an additional bathroom in the rooms.While in Loja, you may want to check out some of the restaurants that are a short walk away from Hotel Villonaco Loja, including Roma Pizzeria (0.5 mi), El Fogón Grill (0.3 mi), and Dumas Trattoria & Restaurant (0.3 mi).If you are interested in exploring Loja, check out a park, such as Parque Recreacional Jipiro.Hotel Villonaco Loja puts the best of Loja at your fingertips, making your stay both relaxing and enjoyable.",Excellent,https://www.tripadvisor.com///Hotel_Review-g644406-d7229676-Reviews-Hotel_Villonaco_Loja-Loja_Loja_Province.html,loja
11,https://www.tripadvisor.com///Hotel_Review-g644406-d626627-Reviews-Hotel_Libertador-Loja_Loja_Province.html,hotel,2022-10-31,Hotel Libertador,64.5,"Colon 14-30 y Bolivar, Loja 110150 Ecuador",3.5,"Hotel Libertador is an excellent choice for travelers visiting Loja, offering a family-friendly environment alongside many helpful amenities designed to enhance your stay.While staying at Hotel Libertador, visitors can check out Plaza Parque Central (2.0 mi), which is a popular Loja attraction.Hotel Libertador is a family-friendly hotel offering a minibar and air conditioning in the rooms, and it is easy to stay connected during your stay as free wifi is offered to guests.The hotel features a 24 hour front desk, a concierge, and room service. Plus, guests can enjoy a pool and an on-site restaurant, which have made this a popular choice among travelers visiting Loja. For guests with a vehicle, a parking garage is available.Loja has plenty of cafes. So when you’re here, be sure to check out popular spots like Tamal Lojano, Cafe Bourbon Arte Latte, and Emporio Lojano, which are serving up some great dishes.If you are interested in exploring Loja, check out an architectural building, such as Puerta de la Ciudad.Enjoy your stay in Loja!",Very good,https://www.tripadvisor.com///Hotel_Review-g644406-d626627-Reviews-Hotel_Libertador-Loja_Loja_Province.html,loja
12,https://www.tripadvisor.com///Hotel_Review-g644406-d10422564-Reviews-Hostal_Pucara-Loja_Loja_Province.html,hotel,2022-10-31,Hostal Pucara,24.5,"Azuay 17-60 Lauro Guerrero y Avenida Manuel Agustin Aguirre, Loja 110150 Ecuador",4.0,"Everyone needs a place to lay their weary head. For travelers visiting Loja, Hostal Pucara is an excellent choice for rest and rejuvenation. Well-known for its budget friendly environment and proximity to great restaurants and attractions, Hostal Pucara makes it easy to enjoy the best of Loja.The rooms offer a seating area and a desk, and getting online is possible, as free wifi is available, allowing you to rest and refresh with ease.Hostal Pucara features a 24 hour front desk, executive lounge access, and baggage storage. Guests arriving by vehicle have access to free parking.Given the close proximity to Plaza Parque Central (2.4 mi), guests of Hostal Pucara can easily experience one of Loja's most popular landmarks.While visiting Loja, you may want to try some tapas at one of the nearby restaurants, such as Topoli Cafe.If you are interested in exploring Loja, check out a historic site, such as Puerta de la Ciudad.Whether you’re traveling for business, pleasure or both, Hostal Pucara is sure to make your visit to Loja one worth remembering.",Very good,https://www.tripadvisor.com///Hotel_Review-g644406-d10422564-Reviews-Hostal_Pucara-Loja_Loja_Province.html,loja
13,https://www.tripadvisor.com///Hotel_Review-g644406-d23368045-Reviews-Hotel_Loja_Bella-Loja_Loja_Province.html,hotel,2022-10-31,Hotel Loja Bella,27.0,"Calle Juan Jose Samaniego Los ahorcados, Loja 110103 Ecuador",4.0,"Located within less than 1 km of Loja and 2.2 km of Yanacocha, Hotel Loja Bella offers rooms in Loja. This 2-star hotel offers a concierge service and a tour desk.",Very good,https://www.tripadvisor.com///Hotel_Review-g644406-d23368045-Reviews-Hotel_Loja_Bella-Loja_Loja_Province.html,loja
14,https://www.tripadvisor.com///Hotel_Review-g644406-d3846832-Reviews-Hotel_Prado_Internacional-Loja_Loja_Province.html,hotel,2022-10-31,Hotel Prado Internacional,35.5,"Loja. Rocafuerte 17-39 y Av. Manuel Agustin Aguirre (Centro), Loja 110150 Ecuador",4.0,"Comfortable rooms, luxuriously furnished, hot water service, cable TV, private bathroom, safety deposit box in each room.Suggestive panoramic restaurant with national and international dishes.Reception hall.Business Center.Room Service.Laundry (washing in water and dry).Telephone service.Internet access.Parking for guests at no additional cost.",Very good,https://www.tripadvisor.com///Hotel_Review-g644406-d3846832-Reviews-Hotel_Prado_Internacional-Loja_Loja_Province.html,loja
15,https://www.tripadvisor.com///Hotel_Review-g644406-d5575424-Reviews-Casben_Hotel-Loja_Loja_Province.html,hotel,2022-10-31,Casben Hotel,78.0,"Avenida Isidro Ayora, Loja 110150 Ecuador",4.5,"Luxury and design define the CASBEN hotel, located near the Land Terminal and the iconic Jipiro Park. It has 31 fully comfortable rooms, an exquisitely decorated presidential suite, a family suite, meeting rooms and business lounge, gym, bar and restaurant, where it has a gastronomy focused on the preparation of international dishes with lojana traditional seasoning. The hand of fresh and typical food. Our service is aimed at satisfying guests, local people and tourists.",Excellent,https://www.tripadvisor.com///Hotel_Review-g644406-d5575424-Reviews-Casben_Hotel-Loja_Loja_Province.html,loja
16,https://www.tripadvisor.com///Hotel_Review-g644406-d1811314-Reviews-Quo_Vadis_Hotel-Loja_Loja_Province.html,hotel,2022-10-31,Quo Vadis Hotel,85.0,"Av. Isidro Ayora y Av. 8 de Diciembre, Loja 110150 Ecuador",4.5,"Everyone needs a place to lay their weary head. For travelers visiting Loja, Quo Vadis Hotel is an excellent choice for rest and rejuvenation. Well-known for its romantic environment and proximity to great restaurants and attractions, Quo Vadis Hotel makes it easy to enjoy the best of Loja.As your “home away from home,” the small hotel rooms offer air conditioning, a minibar, and a refrigerator, and getting online is easy, with free wifi available.Guests have access to room service and a concierge while staying at Quo Vadis Hotel. In addition, Quo Vadis Hotel offers an on-site restaurant, which will help make your Loja trip additionally gratifying. And, as an added convenience, there is free parking available to guests.Given the close proximity to Iglesia San Francisco (1.2 mi), guests of Quo Vadis Hotel can easily experience one of Loja's most popular landmarks.Travelers looking to enjoy some tapas can head to Topoli Cafe. Otherwise, you may want to check out an Asian restaurant such as Alivinatu Spa Terapéutico - Restaurant.There is no shortage of things to do in the area: explore popular historic sites such as Puerta de la Ciudad.Quo Vadis Hotel is sure to make your visit to Loja one worth remembering.",Excellent,https://www.tripadvisor.com///Hotel_Review-g644406-d1811314-Reviews-Quo_Vadis_Hotel-Loja_Loja_Province.html,loja
17,https://www.tripadvisor.com///Hotel_Review-g644406-d12189833-Reviews-Hacienda_Gonzabal-Loja_Loja_Province.html,hotel,2022-10-31,Hacienda Gonzabal,42.0,"Via Taquil Chuquiribamba Barrio Gonzabal s/n, Loja 110160 Ecuador",5.0,"Offering mountain views, Hacienda Gonzabal 34 km from Loja features accommodation and a garden. Opening to a terrace with garden views, all units are fitted with a kitchen with an oven and a microwave.",Excellent,https://www.tripadvisor.com///Hotel_Review-g644406-d12189833-Reviews-Hacienda_Gonzabal-Loja_Loja_Province.html,loja
18,https://www.tripadvisor.com///Hotel_Review-g644406-d16679182-Reviews-Hostal_Camil-Loja_Loja_Province.html,hotel,2022-10-31,Hostal Camil,37.5,"223-102 18 de Noviembre Between Gonzanama and Chile, Loja Ecuador",4.0,"Featuring a terrace, HOSTAL CAMIL offers rooms in Loja, 1.5 km from Loja and 3 km from Noraspamba. Among the facilities at this property are a 24-hour front desk and dry cleaning services, along with free WiFi throughout the property.",Very good,https://www.tripadvisor.com///Hotel_Review-g644406-d16679182-Reviews-Hostal_Camil-Loja_Loja_Province.html,loja
19,https://www.tripadvisor.com///Hotel_Review-g644406-d2689725-Reviews-Grand_Hotel_Loja-Loja_Loja_Province.html,hotel,2022-10-31,Grand Hotel Loja,38.5,"Av. Manuel Agustin Aguirre y Rocafuerte esquina, Loja 110150 Ecuador",3.5,"The Grand Hotel Loja has comfortable and spacious rooms, suites, with private bathroom, cable TV, unlimited WIFI internet, room service, cafeteria, restaurant, rooms for all kinds of events, business center, laundry, private parking and more services for you to your stay is pleasant, our hotel is in the center of the city of Loja and 40 minutes from the airport in the city of Catmayo. The Grand Hotel Loja is the best place to stay in the city of Loja and fully enjoy our hospitality, quality and personalized service. Taste our typical foods such as Repe Lojano, cecina, mil con quesilo and a delicious horchata, meals that we prepare with the high quality, hygiene and service that characterizes us. They undoubtedly make the Grand Hotel Loja an obligatory stop for national and international tourists.",Very good,https://www.tripadvisor.com///Hotel_Review-g644406-d2689725-Reviews-Grand_Hotel_Loja-Loja_Loja_Province.html,loja
20,https://www.tripadvisor.com///Hotel_Review-g644406-d4267125-Reviews-San_Sebastian_Hotel-Loja_Loja_Province.html,hotel,2022-10-31,San Sebastian Hotel,54.5,"De Noviembre S/N y Azuay 18, Loja 110150 Ecuador",3.5,Hotel San Sebastian.,Very good,https://www.tripadvisor.com///Hotel_Review-g644406-d4267125-Reviews-San_Sebastian_Hotel-Loja_Loja_Province.html,loja
21,https://www.tripadvisor.com///Hotel_Review-g644406-d7707597-Reviews-Floy_s_International_Hotel-Loja_Loja_Province.html,hotel,2022-10-31,Floy's International Hotel,45.0,"Cnr 18 de Noviembre & Valdivieso, Loja 110150 Ecuador",4.5,"Floy's International Hotel is an excellent choice for travelers visiting Loja, offering a family-friendly environment alongside many helpful amenities designed to enhance your stay.For those interested in checking out Plaza Parque Central (1.8 mi) while visiting Loja, Floy's International Hotel is a short distance away.The rooms offer a desk, and getting online is possible, as free wifi is available, allowing you to rest and refresh with ease.Floy's International Hotel features a 24 hour front desk and a coffee shop. In addition, as a valued Floy's International Hotel guest, you can enjoy a hot tub and an on-site restaurant that are available on-site. Guests arriving by vehicle have access to free parking.While in Loja be sure to experience local tapas favorites at Topoli Cafe.Loja is also home to Puerta de la Ciudad, a popular architectural building that is not too far from Floy's International Hotel.Enjoy your stay in Loja!",Excellent,https://www.tripadvisor.com///Hotel_Review-g644406-d7707597-Reviews-Floy_s_International_Hotel-Loja_Loja_Province.html,loja
22,https://www.tripadvisor.com///Hotel_Review-g644406-d11877248-Reviews-Hotel_Caluva-Loja_Loja_Province.html,hotel,2022-10-31,Hotel Caluva,27.5,"Ramon Pinto 07/15, Loja 110150 Ecuador",4.5, Featuring free WiFi Hotel Caluva offers accommodation in downtown Loja. Welcome drinks are offered on arrival. The rooms have a flat-screen TV with cable channels. You will find a coffee machine in the room.,Excellent,https://www.tripadvisor.com///Hotel_Review-g644406-d11877248-Reviews-Hotel_Caluva-Loja_Loja_Province.html,loja
23,https://www.tripadvisor.com///Hotel_Review-g644406-d951062-Reviews-Hotel_Bombuscaro-Loja_Loja_Province.html,hotel,2022-10-31,Hotel Bombuscaro,36.5,"De Agosto y Av. Universitaria 10, Loja 110150 Ecuador",3.0,"See why so many travelers make Hotel Bombuscaro their hotel of choice when visiting Loja. Providing an ideal mix of value, comfort and convenience, it offers a budget friendly setting with an array of amenities designed for travelers like you.You’ll enjoy relaxing rooms that offer a minibar, a seating area, and a desk, and you can stay connected during your stay as Hotel Bombuscaro offers guests free wifi.The hotel features a 24 hour front desk and executive lounge access.Given the close proximity to Plaza Parque Central (1.6 mi), guests of Hotel Bombuscaro can easily experience one of Loja's most popular landmarks.Travelers looking to enjoy some ribs can head to Mama Lola or Dumas Trattoria & Restaurant. Otherwise, you may want to check out a cafe such as Tamal Lojano, Cafe Bourbon Arte Latte, or Emporio Lojano.During your visit, be sure to check out popular attractions like Parque Recreacional Jipiro (1.0 mi), Puerta de la Ciudad (0.3 mi), and Iglesia San Francisco (0.4 mi), which are all within walking distance of the hotel.We’re sure you’ll enjoy your stay at Hotel Bombuscaro as you experience all of the things Loja has to offer.",Average,https://www.tripadvisor.com///Hotel_Review-g644406-d951062-Reviews-Hotel_Bombuscaro-Loja_Loja_Province.html,loja
25,https://www.tripadvisor.com///Hotel_Review-g644406-d1239597-Reviews-Sonesta_Hotel_Loja-Loja_Loja_Province.html,hotel,2022-10-31,Sonesta Hotel Loja,89.5,"Av. Zoilo Rodriguez y Antisana, Loja 110150 Ecuador",4.5,"Sonesta International Hotels Corporation is further expanding its international portfolio and footprint in South America with the announcement of Sonesta Hotel Loja, formerly known Howard Johnson Loja,the brand’s second property in the country of Ecuador. Located 250 miles southeast from the major port city of Guayaquil. Loja is the capital city the country’s southernmost province by the same name, which shares a border with Peru and is considered the administrative headquarters of the region. Its proximity just five minutes from the center of the city, near the Zamora River and many key attractions and businesses makes it a great choice for both business and leisure travelers. The hotel features 73 fully equipped guest rooms including four suites. Guests are greeted with a variety of on-site amenities such as a full-service restaurant, bar/lounge, deli and bakery, business center, gym, pool, turkish bath and steam to enjoy, relax and unwind after a day of work or sightseeing.",Excellent,https://www.tripadvisor.com///Hotel_Review-g644406-d1239597-Reviews-Sonesta_Hotel_Loja-Loja_Loja_Province.html,loja
26,https://www.tripadvisor.com///Hotel_Review-g644406-d23806734-Reviews-Casa_Bolivar_Hotel_Museo-Loja_Loja_Province.html,hotel,2022-10-31,Casa Bolivar Hotel Museo,92.5,"Bolívar y Colón Esquina, Loja 110101 Ecuador",4.5,,Excellent,https://www.tripadvisor.com///Hotel_Review-g644406-d23806734-Reviews-Casa_Bolivar_Hotel_Museo-Loja_Loja_Province.html,loja
27,https://www.tripadvisor.com///Hotel_Review-g1028592-d3953842-Reviews-Hosteria_Paraiso-Vilcabamba_Loja_Province.html,hotel,2022-10-31,Hosteria Paraiso,65.0,"Avenida Eterna Juventud Junto al Parque de la Madre, Vilcabamba 110161 Ecuador",4.5,"Vilcabamba is the perfect place to rest, relax and reconnect with nature. Hostería Paraíso invites you to enjoy the magic of the valley of longevity with us. In our facilities, you can stay in our comfortable cabins, receive a massage in our Bioenergetic Pyramid, enjoy the beautiful climate of the valley in the pool area or taste the great variety of typical dishes in our restaurant. In the same way, we can advise you on any activity that you would like to do, like hiking around the valley, horseback riding, climbing to Mandango and more! Hope to see you soon!",Excellent,https://www.tripadvisor.com///Hotel_Review-g1028592-d3953842-Reviews-Hosteria_Paraiso-Vilcabamba_Loja_Province.html,loja
